{
  "baseline_sha256": "bf53826c840cec9f5cb4044a121a4bada29dd14f56c9f1b1b7633b57cc067306",
  "baseline_size": 13372318,
  "changed_member_count": 2,
  "changed_members": [
    "event/b1/event_jp/ce11/event_ce11_070.ebd",
    "event/b1/event_jp/em01/event_em01_090.ebd"
  ],
  "local_profile_path": ".local/build/quartet_restoration/repack_tests/residual_shared_presentation/profiles/shared_presentation_d88c7c3a6f/output/Data/PACK11.PAK",
  "profile_id": "shared_presentation_d88c7c3a6f",
  "profile_sha256": "6fcb50fbf43643e147085b0cfbedc6961989fe3c8833dc9f36e87198c88b15b6",
  "profile_size": 13372318,
  "runtime_validated": false,
  "schema_version": 1,
  "target_relative_path": "Data/PACK11.PAK",
  "workstream_id": "quartet_restoration",
  "workstream_version": "0.1.56"
}
